term,Description,GeneRatio,BgRatio,pvalue,p.adjust,qvalue,geneID,Count
GO:0060271,cilium assembly,35/108,377/18866,5.26623E-33,1.48455E-29,1.07376E-29,AKAP9/ATXN10/AVIL/CCDC39/CCDC40/CCDC63/CCDC65/CCDC88A/CDK1/CDK5RAP2/CEP120/CEP290/CKAP5/CLASP1/CSNK1D/CSNK1E/HAP1/HAUS5/HAUS6/HAUS7/HAUS8/HDAC6/HSP90AA1/HSPB11/HTT/PAFAH1B1/PRKACA/TUBA1A/TUBA4A/TUBB/TUBB4A/TUBB4B/TUBG1/YWHAE/YWHAG,35
GO:0044782,cilium organization,35/108,397/18866,3.24028E-32,4.56718E-29,3.30338E-29,AKAP9/ATXN10/AVIL/CCDC39/CCDC40/CCDC63/CCDC65/CCDC88A/CDK1/CDK5RAP2/CEP120/CEP290/CKAP5/CLASP1/CSNK1D/CSNK1E/HAP1/HAUS5/HAUS6/HAUS7/HAUS8/HDAC6/HSP90AA1/HSPB11/HTT/PAFAH1B1/PRKACA/TUBA1A/TUBA4A/TUBB/TUBB4A/TUBB4B/TUBG1/YWHAE/YWHAG,35
GO:0097711,ciliary basal body-plasma membrane docking,23/108,95/18866,1.03852E-31,9.75865E-29,7.05831E-29,AKAP9/CDK1/CDK5RAP2/CEP290/CKAP5/CLASP1/CSNK1D/CSNK1E/HAUS5/HAUS6/HAUS7/HAUS8/HSP90AA1/PAFAH1B1/PRKACA/TUBA1A/TUBA4A/TUBB/TUBB4A/TUBB4B/TUBG1/YWHAE/YWHAG,23
GO:0010389,regulation of G2/M transition of mitotic cell cycle,25/108,200/18866,9.3828E-27,6.61253E-24,4.78276E-24,AKAP9/APP/AURKA/CDK1/CDK5RAP2/CEP290/CKAP5/CLASP1/CSNK1D/CSNK1E/HAUS5/HAUS6/HAUS7/HAUS8/HSP90AA1/PAFAH1B1/PRKACA/TUBA1A/TUBA4A/TUBB/TUBB4A/TUBB4B/TUBG1/YWHAE/YWHAG,25
GO:1902749,regulation of cell cycle G2/M phase transition,25/108,217/18866,7.61917E-26,4.29569E-23,3.10702E-23,AKAP9/APP/AURKA/CDK1/CDK5RAP2/CEP290/CKAP5/CLASP1/CSNK1D/CSNK1E/HAUS5/HAUS6/HAUS7/HAUS8/HSP90AA1/PAFAH1B1/PRKACA/TUBA1A/TUBA4A/TUBB/TUBB4A/TUBB4B/TUBG1/YWHAE/YWHAG,25
GO:0140056,organelle localization by membrane tethering,23/108,171/18866,2.14683E-25,1.00865E-22,7.29545E-23,AKAP9/CDK1/CDK5RAP2/CEP290/CKAP5/CLASP1/CSNK1D/CSNK1E/HAUS5/HAUS6/HAUS7/HAUS8/HSP90AA1/PAFAH1B1/PRKACA/TUBA1A/TUBA4A/TUBB/TUBB4A/TUBB4B/TUBG1/YWHAE/YWHAG,23
GO:0022406,membrane docking,23/108,180/18866,7.28247E-25,2.93275E-22,2.12122E-22,AKAP9/CDK1/CDK5RAP2/CEP290/CKAP5/CLASP1/CSNK1D/CSNK1E/HAUS5/HAUS6/HAUS7/HAUS8/HSP90AA1/PAFAH1B1/PRKACA/TUBA1A/TUBA4A/TUBB/TUBB4A/TUBB4B/TUBG1/YWHAE/YWHAG,23
GO:0000086,G2/M transition of mitotic cell cycle,25/108,254/18866,4.13514E-24,1.45712E-21,1.05392E-21,AKAP9/APP/AURKA/CDK1/CDK5RAP2/CEP290/CKAP5/CLASP1/CSNK1D/CSNK1E/HAUS5/HAUS6/HAUS7/HAUS8/HSP90AA1/PAFAH1B1/PRKACA/TUBA1A/TUBA4A/TUBB/TUBB4A/TUBB4B/TUBG1/YWHAE/YWHAG,25
GO:0044839,cell cycle G2/M phase transition,25/108,273/18866,2.52577E-23,7.91128E-21,5.72213E-21,AKAP9/APP/AURKA/CDK1/CDK5RAP2/CEP290/CKAP5/CLASP1/CSNK1D/CSNK1E/HAUS5/HAUS6/HAUS7/HAUS8/HSP90AA1/PAFAH1B1/PRKACA/TUBA1A/TUBA4A/TUBB/TUBB4A/TUBB4B/TUBG1/YWHAE/YWHAG,25
GO:1901990,regulation of mitotic cell cycle phase transition,28/108,448/18866,1.5056E-21,4.24429E-19,3.06984E-19,AKAP9/AKT1/ANXA1/APP/AURKA/CDK1/CDK2AP2/CDK5RAP2/CEP290/CKAP5/CLASP1/CSNK1D/CSNK1E/HAUS5/HAUS6/HAUS7/HAUS8/HSP90AA1/PAFAH1B1/PRKACA/TUBA1A/TUBA4A/TUBB/TUBB4A/TUBB4B/TUBG1/YWHAE/YWHAG,28
GO:1901987,regulation of cell cycle phase transition,28/108,486/18866,1.3439E-20,3.44404E-18,2.49103E-18,AKAP9/AKT1/ANXA1/APP/AURKA/CDK1/CDK2AP2/CDK5RAP2/CEP290/CKAP5/CLASP1/CSNK1D/CSNK1E/HAUS5/HAUS6/HAUS7/HAUS8/HSP90AA1/PAFAH1B1/PRKACA/TUBA1A/TUBA4A/TUBB/TUBB4A/TUBB4B/TUBG1/YWHAE/YWHAG,28
GO:0031023,microtubule organizing center organization,14/108,136/18866,4.06578E-14,9.55119E-12,6.90825E-12,AURKA/CCDC78/CDK1/CDK5RAP2/CEP120/CKAP5/CLASP1/CTNNB1/HAUS5/HAUS6/HAUS7/HAUS8/PAFAH1B1/TUBE1,14
GO:0032886,regulation of microtubule-based process,16/108,240/18866,5.13363E-13,1.11321E-10,8.05169E-11,AKAP9/AURKA/CCDC39/CCDC40/CCDC65/CDK2AP2/CDK5RAP2/CEP120/CKAP5/CLASP1/CTNNB1/GSK3B/HAP1/HDAC6/PAFAH1B1/TUBB4A,16
GO:0030705,cytoskeleton-dependent intracellular transport,14/108,200/18866,8.36217E-12,1.68378E-09,1.21786E-09,AP3B2/AP3M2/APP/CCDC88A/HAP1/HIF1A/HSPA8/HSPB11/HTT/PAFAH1B1/TUBA1A/TUBA1B/TUBA1C/TUBB,14
GO:0007051,spindle organization,13/108,183/18866,4.04653E-11,7.60478E-09,5.50044E-09,AURKA/CEP120/CKAP5/CLASP1/CSNK1D/HAUS5/HAUS6/HAUS7/HAUS8/TUBB/TUBG1/TUBGCP2/TUBGCP3,13
GO:0007098,centrosome cycle,11/108,125/18866,1.38578E-10,2.44158E-08,1.76596E-08,AURKA/CDK1/CDK5RAP2/CEP120/CKAP5/CTNNB1/HAUS5/HAUS6/HAUS7/HAUS8/TUBE1,11
GO:0007020,microtubule nucleation,7/108,29/18866,2.32796E-10,3.8603E-08,2.79211E-08,AKAP9/CKAP5/CLASP1/CSNK1D/TUBG1/TUBGCP2/TUBGCP3,7
GO:0018105,peptidyl-serine phosphorylation,15/108,310/18866,2.71602E-10,4.25358E-08,3.07656E-08,HSP90AB1/AKAP9/AKT1/APP/AURKA/CDK1/CSNK1A1/CSNK1D/CSNK1E/CSNK1G1/GSK3B/HDAC6/HIPK1/HSP90AA1/PRKACA,15
GO:0046785,microtubule polymerization,9/108,77/18866,5.49077E-10,8.14656E-08,5.89231E-08,AKAP9/CDK5RAP2/CKAP5/CLASP1/CSNK1D/TUBB4A/TUBG1/TUBGCP2/TUBGCP3,9
GO:0018209,peptidyl-serine modification,15/108,333/18866,7.30992E-10,1.03033E-07,7.45228E-08,HSP90AB1/AKAP9/AKT1/APP/AURKA/CDK1/CSNK1A1/CSNK1D/CSNK1E/CSNK1G1/GSK3B/HDAC6/HIPK1/HSP90AA1/PRKACA,15
GO:0070507,regulation of microtubule cytoskeleton organization,12/108,190/18866,9.22483E-10,1.23832E-07,8.95664E-08,AKAP9/AURKA/CDK2AP2/CDK5RAP2/CEP120/CKAP5/CLASP1/CTNNB1/GSK3B/HDAC6/PAFAH1B1/TUBB4A,12
GO:0010821,regulation of mitochondrion organization,12/108,191/18866,9.79683E-10,1.25533E-07,9.07964E-08,AKT1/GSK3B/HDAC6/HIF1A/HIGD1A/HSPA1L/HTT/SQSTM1/YWHAB/YWHAE/YWHAG/YWHAQ,12
GO:0051225,spindle assembly,10/108,115/18866,1.11765E-09,1.36985E-07,9.90792E-08,AURKA/CLASP1/CSNK1D/HAUS5/HAUS6/HAUS7/HAUS8/TUBB/TUBGCP2/TUBGCP3,10
GO:0031109,microtubule polymerization or depolymerization,10/108,117/18866,1.32477E-09,1.55606E-07,1.12548E-07,AKAP9/CDK5RAP2/CKAP5/CLASP1/CSNK1D/HDAC6/TUBB4A/TUBG1/TUBGCP2/TUBGCP3,10
GO:0007018,microtubule-based movement,15/108,368/18866,2.86541E-09,3.23104E-07,2.33697E-07,AP3B2/AP3M2/APP/CCDC39/CCDC40/CCDC63/CCDC65/HAP1/HDAC6/HIF1A/HSPA8/HSPB11/HTT/PAFAH1B1/ZBBX,15
GO:0090316,positive regulation of intracellular protein transport,11/108,182/18866,7.6218E-09,8.26379E-07,5.97709E-07,HSP90AB1/CDK1/CEP290/GSK3B/HSPA1L/PRKACA/PSEN1/YWHAB/YWHAE/YWHAG/YWHAQ,11
GO:1903829,positive regulation of cellular protein localization,14/108,338/18866,8.22095E-09,8.58328E-07,6.20818E-07,HSP90AB1/AKT1/CCDC88A/CDK1/CEP290/GSK3B/HSPA1L/PRKACA/PSEN1/SQSTM1/YWHAB/YWHAE/YWHAG/YWHAQ,14
GO:0099111,microtubule-based transport,11/108,190/18866,1.19356E-08,1.20166E-06,8.69143E-07,AP3B2/AP3M2/APP/CCDC39/CCDC40/HAP1/HIF1A/HSPA8/HSPB11/HTT/PAFAH1B1,11
GO:0010822,positive regulation of mitochondrion organization,9/108,119/18866,2.69831E-08,2.62295E-06,1.89714E-06,GSK3B/HDAC6/HIF1A/HSPA1L/HTT/YWHAB/YWHAE/YWHAG/YWHAQ,9
GO:0043393,regulation of protein binding,11/108,211/18866,3.52703E-08,3.31423E-06,2.39714E-06,HSP90AB1/AKT1/APP/AURKA/CSNK1E/CTNNBIP1/GSK3B/HDAC5/HSF1/PRKACA/PSEN1,11
GO:0032388,positive regulation of intracellular transport,11/108,222/18866,5.93389E-08,5.39601E-06,3.90287E-06,HSP90AB1/CDK1/CEP290/GSK3B/HSPA1L/PRKACA/PSEN1/YWHAB/YWHAE/YWHAG/YWHAQ,11
GO:0031122,cytoplasmic microtubule organization,7/108,63/18866,7.03544E-08,6.19778E-06,4.48278E-06,CCDC88A/CEP120/CLASP1/PAFAH1B1/TUBG1/TUBGCP2/TUBGCP3,7
GO:0008088,axo-dendritic transport,7/108,70/18866,1.47515E-07,1.26014E-05,9.11442E-06,AP3B2/AP3M2/APP/HAP1/HIF1A/HSPA8/PAFAH1B1,7
GO:0051098,regulation of binding,13/108,367/18866,1.79857E-07,1.49123E-05,1.07859E-05,HSP90AB1/AKT1/APP/AURKA/CSNK1A1/CSNK1E/CTNNB1/CTNNBIP1/GSK3B/HDAC5/HSF1/PRKACA/PSEN1,13
GO:1904951,positive regulation of establishment of protein localization,13/108,370/18866,1.97469E-07,1.59047E-05,1.15037E-05,HSP90AB1/CDK1/CEP120/CEP290/GSK3B/HIF1A/HSPA1L/PRKACA/PSEN1/YWHAB/YWHAE/YWHAG/YWHAQ,13
GO:0033157,regulation of intracellular protein transport,11/108,264/18866,3.40609E-07,2.60544E-05,1.88448E-05,HSP90AB1/CDK1/CEP290/GSK3B/HSPA1L/PRKACA/PSEN1/YWHAB/YWHAE/YWHAG/YWHAQ,11
GO:1900034,regulation of cellular response to heat,7/108,79/18866,3.4197E-07,2.60544E-05,1.88448E-05,HSP90AB1/GSK3B/HSF1/HSP90AA1/HSPA1L/HSPA8/YWHAE,7
GO:0031331,positive regulation of cellular catabolic process,13/108,390/18866,3.6012E-07,2.63654E-05,1.90698E-05,AKT1/APP/AURKA/CSNK1A1/CSNK1D/CSNK1E/GSK3B/HDAC6/HIF1A/HSF1/HSP90AA1/HTT/PSEN1,13
GO:0010970,transport along microtubule,9/108,161/18866,3.64758E-07,2.63654E-05,1.90698E-05,AP3B2/AP3M2/APP/HAP1/HIF1A/HSPA8/HSPB11/HTT/PAFAH1B1,9
GO:0042176,regulation of protein catabolic process,13/108,397/18866,4.40626E-07,3.10531E-05,2.24603E-05,HSP90AB1/AKT1/AURKA/CSNK1A1/CSNK1D/CSNK1E/EEF1A1/EEF1A2/GSK3B/HGS/HSP90AA1/PRKACA/PSEN1,13
GO:0009408,response to heat,9/108,166/18866,4.72384E-07,3.24793E-05,2.34919E-05,HSP90AB1/AKT1/GSK3B/HSF1/HSP90AA1/HSPA1L/HSPA8/PRKACA/YWHAE,9
GO:0034605,cellular response to heat,8/108,125/18866,5.99637E-07,4.02471E-05,2.91102E-05,HSP90AB1/GSK3B/HSF1/HSP90AA1/HSPA1L/HSPA8/PRKACA/YWHAE,8
GO:0032436,positive regulation of proteasomal ubiquitin-dependent protein catabolic process,7/108,87/18866,6.63984E-07,4.35296E-05,3.14844E-05,AKT1/AURKA/CSNK1A1/CSNK1D/CSNK1E/GSK3B/PSEN1,7
GO:0032434,regulation of proteasomal ubiquitin-dependent protein catabolic process,8/108,131/18866,8.57288E-07,5.49249E-05,3.97265E-05,HSP90AB1/AKT1/AURKA/CSNK1A1/CSNK1D/CSNK1E/GSK3B/PSEN1,8
GO:0051222,positive regulation of protein transport,12/108,354/18866,8.76893E-07,5.49325E-05,3.9732E-05,HSP90AB1/CDK1/CEP290/GSK3B/HIF1A/HSPA1L/PRKACA/PSEN1/YWHAB/YWHAE/YWHAG/YWHAQ,12
GO:0009266,response to temperature stimulus,10/108,233/18866,9.15629E-07,5.61121E-05,4.05852E-05,HSP90AB1/AKT1/ANO3/GSK3B/HSF1/HSP90AA1/HSPA1L/HSPA8/PRKACA/YWHAE,10
GO:0032386,regulation of intracellular transport,12/108,358/18866,9.86723E-07,5.91824E-05,4.28059E-05,HSP90AB1/CDK1/CEP290/GSK3B/HAP1/HSPA1L/PRKACA/PSEN1/YWHAB/YWHAE/YWHAG/YWHAQ,12
GO:0051258,protein polymerization,11/108,300/18866,1.20208E-06,7.05974E-05,5.10622E-05,AKAP9/AVIL/CDK5RAP2/CKAP5/CLASP1/CSNK1D/HSP90AA1/TUBB4A/TUBG1/TUBGCP2/TUBGCP3,11
GO:1901030,positive regulation of mitochondrial outer membrane permeabilization involved in apoptotic signaling pathway,5/108,35/18866,1.58564E-06,9.12231E-05,6.59805E-05,GSK3B/YWHAB/YWHAE/YWHAG/YWHAQ,5
GO:0061136,regulation of proteasomal protein catabolic process,9/108,193/18866,1.66512E-06,9.38793E-05,6.79017E-05,HSP90AB1/AKT1/AURKA/CSNK1A1/CSNK1D/CSNK1E/GSK3B/PRKACA/PSEN1,9
GO:0061684,chaperone-mediated autophagy,4/108,16/18866,1.75296E-06,9.6894E-05,7.00822E-05,EEF1A1/EEF1A2/HSP90AA1/HSPA8,4
GO:2000060,positive regulation of ubiquitin-dependent protein catabolic process,7/108,102/18866,1.95602E-06,0.000104984,7.59334E-05,AKT1/AURKA/CSNK1A1/CSNK1D/CSNK1E/GSK3B/PSEN1,7
GO:0009896,positive regulation of catabolic process,13/108,454/18866,1.9738E-06,0.000104984,7.59334E-05,AKT1/APP/AURKA/CSNK1A1/CSNK1D/CSNK1E/GSK3B/HDAC6/HIF1A/HSF1/HSP90AA1/HTT/PSEN1,13
GO:0007389,pattern specification process,13/108,455/18866,2.02225E-06,0.000105569,7.63568E-05,AR/AURKA/CCDC39/CCDC40/CTNNB1/CTNNBIP1/HHIP/HIF1A/HIPK1/HSPB11/PRKACA/PRKACB/PSEN1,13
GO:0046824,positive regulation of nucleocytoplasmic transport,6/108,66/18866,2.10339E-06,0.000106207,7.68184E-05,HSP90AB1/CDK1/GSK3B/PRKACA/PSEN1/YWHAE,6
GO:0071542,dopaminergic neuron differentiation,5/108,37/18866,2.10983E-06,0.000106207,7.68184E-05,CSNK1D/CSNK1E/CTNNB1/GSK3B/HIF1A,5
GO:1903364,positive regulation of cellular protein catabolic process,8/108,149/18866,2.26579E-06,0.000112057,8.10495E-05,AKT1/AURKA/CSNK1A1/CSNK1D/CSNK1E/GSK3B/HSP90AA1/PSEN1,8
GO:1903362,regulation of cellular protein catabolic process,10/108,260/18866,2.46171E-06,0.000119647,8.65395E-05,HSP90AB1/AKT1/AURKA/CSNK1A1/CSNK1D/CSNK1E/GSK3B/HSP90AA1/PRKACA/PSEN1,10
GO:0010256,endomembrane system organization,13/108,468/18866,2.75585E-06,0.000131674,9.52379E-05,AKAP9/AKT1/ANO3/ANXA8/AR/CDK1/CLASP1/CSNK1A1/CSNK1D/HGS/HTT/PAFAH1B1/SQSTM1,13
GO:0034199,activation of protein kinase A activity,4/108,18/18866,2.92139E-06,0.000137032,9.91133E-05,PRKACA/PRKACB/PRKACG/PRKAR1A,4
GO:1901653,cellular response to peptide,12/108,398/18866,2.96521E-06,0.000137032,9.91133E-05,AKT1/APP/EEF2K/GSK3B/HDAC5/HSF1/PRKACA/PRKACB/PRKACG/PRKAR1A/PSEN1/YWHAG,12
GO:0060562,epithelial tube morphogenesis,11/108,331/18866,3.11509E-06,0.000141636,0.000102444,AR/CCDC39/CCDC40/CEP290/CTNNB1/CTNNBIP1/HHIP/HIF1A/PRKACA/PRKACB/PSEN1,11
GO:1901800,positive regulation of proteasomal protein catabolic process,7/108,110/18866,3.24665E-06,0.000145275,0.000105075,AKT1/AURKA/CSNK1A1/CSNK1D/CSNK1E/GSK3B/PSEN1,7
GO:0051650,establishment of vesicle localization,9/108,212/18866,3.60472E-06,0.000158777,0.000114841,AP3B2/AP3M2/CLASP1/CSNK1D/CTNNB1/HAP1/HTT/PAFAH1B1/PSEN1,9
GO:2000058,regulation of ubiquitin-dependent protein catabolic process,8/108,159/18866,3.67909E-06,0.000159559,0.000115407,HSP90AB1/AKT1/AURKA/CSNK1A1/CSNK1D/CSNK1E/GSK3B/PSEN1,8
GO:2001233,regulation of apoptotic signaling pathway,12/108,413/18866,4.33144E-06,0.000185005,0.000133812,AKT1/AR/CTNNB1/GSK3B/HIF1A/HIGD1A/HTT/PSEN1/YWHAB/YWHAE/YWHAG/YWHAQ,12
GO:0021987,cerebral cortex development,7/108,118/18866,5.18132E-06,0.000218002,0.000157678,CEP120/CTNNB1/GSK3B/HIF1A/PAFAH1B1/PSEN1/YWHAE,7
GO:0051204,protein insertion into mitochondrial membrane,5/108,45/18866,5.70231E-06,0.000232968,0.000168503,HSP90AA1/YWHAB/YWHAE/YWHAG/YWHAQ,5
GO:1901028,regulation of mitochondrial outer membrane permeabilization involved in apoptotic signaling pathway,5/108,45/18866,5.70231E-06,0.000232968,0.000168503,GSK3B/YWHAB/YWHAE/YWHAG/YWHAQ,5
GO:1903050,regulation of proteolysis involved in cellular protein catabolic process,9/108,225/18866,5.84994E-06,0.000235585,0.000170396,HSP90AB1/AKT1/AURKA/CSNK1A1/CSNK1D/CSNK1E/GSK3B/PRKACA/PSEN1,9
GO:0031016,pancreas development,6/108,79/18866,6.05899E-06,0.000240568,0.000173999,AKT1/ANXA1/CCDC39/CCDC40/CTNNB1/GSK3B,6
GO:0051648,vesicle localization,9/108,229/18866,6.74612E-06,0.000264106,0.000191025,AP3B2/AP3M2/CLASP1/CSNK1D/CTNNB1/HAP1/HTT/PAFAH1B1/PSEN1,9
GO:0051656,establishment of organelle localization,12/108,432/18866,6.83922E-06,0.000264106,0.000191025,AP3B2/AP3M2/CDK5RAP2/CEP120/CLASP1/CSNK1D/CTNNB1/HAP1/HIF1A/HTT/PAFAH1B1/PSEN1,12
GO:0008637,apoptotic mitochondrial changes,7/108,125/18866,7.584E-06,0.00028891,0.000208965,AKT1/GSK3B/HIGD1A/YWHAB/YWHAE/YWHAG/YWHAQ,7
GO:0060632,regulation of microtubule-based movement,5/108,48/18866,7.88361E-06,0.000296319,0.000214324,CCDC39/CCDC40/CCDC65/HAP1/HDAC6,5
GO:1903052,positive regulation of proteolysis involved in cellular protein catabolic process,7/108,127/18866,8.41938E-06,0.000312293,0.000225877,AKT1/AURKA/CSNK1A1/CSNK1D/CSNK1E/GSK3B/PSEN1,7
GO:0047496,vesicle transport along microtubule,5/108,49/18866,8.73967E-06,0.000315861,0.000228458,AP3B2/AP3M2/HAP1/HTT/PAFAH1B1,5
GO:0090151,establishment of protein localization to mitochondrial membrane,5/108,49/18866,8.73967E-06,0.000315861,0.000228458,HSP90AA1/YWHAB/YWHAE/YWHAG/YWHAQ,5
GO:0031110,regulation of microtubule polymerization or depolymerization,6/108,85/18866,9.27233E-06,0.000326734,0.000236322,AKAP9/CDK5RAP2/CKAP5/CLASP1/HDAC6/TUBB4A,6
GO:0072384,organelle transport along microtubule,6/108,85/18866,9.27233E-06,0.000326734,0.000236322,AP3B2/AP3M2/HAP1/HIF1A/HTT/PAFAH1B1,6
GO:1902903,regulation of supramolecular fiber organization,11/108,373/18866,9.68066E-06,0.000336911,0.000243684,AKAP9/APP/AVIL/CCDC88A/CDK5RAP2/CKAP5/CLASP1/HDAC6/HSPA8/PSEN1/TUBB4A,11
GO:0045724,positive regulation of cilium assembly,4/108,24/18866,9.87973E-06,0.000339646,0.000245662,CCDC88A/CEP120/HAP1/HTT,4
GO:0043254,regulation of protein-containing complex assembly,12/108,449/18866,1.00853E-05,0.000342536,0.000247752,AKAP9/AVIL/CDK5RAP2/CKAP5/CLASP1/CTNNBIP1/GSK3B/HDAC6/HSF1/HSP90AA1/HSPA8/TUBB4A,12
GO:0031113,regulation of microtubule polymerization,5/108,51/18866,1.06689E-05,0.000358042,0.000258968,AKAP9/CDK5RAP2/CKAP5/CLASP1/TUBB4A,5
GO:0045995,regulation of embryonic development,7/108,134/18866,1.19687E-05,0.000396938,0.0002871,AR/CDK1/CLASP1/CTNNB1/PAFAH1B1/PRKACA/PRKACB,7
GO:0042058,regulation of epidermal growth factor receptor signaling pathway,6/108,90/18866,1.28983E-05,0.000422793,0.000305801,AKT1/APP/CCDC88A/HAP1/HGS/PSEN1,6
GO:0071377,cellular response to glucagon stimulus,4/108,26/18866,1.37781E-05,0.000436408,0.000315649,PRKACA/PRKACB/PRKACG/PRKAR1A,4
GO:1900739,regulation of protein insertion into mitochondrial membrane involved in apoptotic signaling pathway,4/108,26/18866,1.37781E-05,0.000436408,0.000315649,YWHAB/YWHAE/YWHAG/YWHAQ,4
GO:1900740,positive regulation of protein insertion into mitochondrial membrane involved in apoptotic signaling pathway,4/108,26/18866,1.37781E-05,0.000436408,0.000315649,YWHAB/YWHAE/YWHAG/YWHAQ,4
GO:0106027,neuron projection organization,6/108,92/18866,1.46361E-05,0.000458436,0.000331581,APP/EEF2K/GSK3B/HDAC6/PAFAH1B1/PSEN1,6
GO:0097345,mitochondrial outer membrane permeabilization,5/108,55/18866,1.55153E-05,0.000480632,0.000347635,GSK3B/YWHAB/YWHAE/YWHAG/YWHAQ,5
GO:0072655,establishment of protein localization to mitochondrion,7/108,140/18866,1.59233E-05,0.000487912,0.0003529,AKT1/HSP90AA1/HSPA1L/YWHAB/YWHAE/YWHAG/YWHAQ,7
GO:0030010,establishment of cell polarity,7/108,141/18866,1.6677E-05,0.00050551,0.000365629,HSP90AB1/CDK5RAP2/CLASP1/GSK3B/HSP90AA1/HTT/PAFAH1B1,7
GO:0045787,positive regulation of cell cycle,11/108,396/18866,1.69099E-05,0.000507117,0.000366792,HSP90AB1/AKT1/ANXA1/APP/AURKA/CDK1/CEP120/CKS1B/HSF1/PAFAH1B1/PRKACA,11
GO:0007006,mitochondrial membrane organization,7/108,142/18866,1.74599E-05,0.000518099,0.000374734,APOO/GSK3B/HSP90AA1/YWHAB/YWHAE/YWHAG/YWHAQ,7
GO:0070585,protein localization to mitochondrion,7/108,144/18866,1.91169E-05,0.000555574,0.00040184,AKT1/HSP90AA1/HSPA1L/YWHAB/YWHAE/YWHAG/YWHAQ,7
GO:1902850,microtubule cytoskeleton organization involved in mitosis,7/108,144/18866,1.91169E-05,0.000555574,0.00040184,AURKA/CDK5RAP2/CKAP5/CLASP1/HTT/PAFAH1B1/TUBG1,7
GO:1901184,regulation of ERBB signaling pathway,6/108,97/18866,1.98192E-05,0.000562676,0.000406977,AKT1/APP/CCDC88A/HAP1/HGS/PSEN1,6
GO:0071375,cellular response to peptide hormone stimulus,10/108,330/18866,1.98977E-05,0.000562676,0.000406977,AKT1/EEF2K/GSK3B/HDAC5/HSF1/PRKACA/PRKACB/PRKACG/PRKAR1A/YWHAG,10
GO:0038127,ERBB signaling pathway,7/108,145/18866,1.99929E-05,0.000562676,0.000406977,AKT1/APP/CCDC88A/HAP1/HGS/HSP90AA1/PSEN1,7
GO:1903749,positive regulation of establishment of protein localization to mitochondrion,5/108,58/18866,2.01597E-05,0.000562676,0.000406977,HSPA1L/YWHAB/YWHAE/YWHAG/YWHAQ,5
GO:0010498,proteasomal protein catabolic process,12/108,483/18866,2.08256E-05,0.000575562,0.000416297,HSP90AB1/AKT1/AURKA/CDK1/CSNK1A1/CSNK1D/CSNK1E/CTNNB1/GSK3B/HSP90B1/PRKACA/PSEN1,12
GO:1904338,regulation of dopaminergic neuron differentiation,3/108,10/18866,2.12625E-05,0.000581933,0.000420905,CSNK1D/CSNK1E/GSK3B,3
GO:0098930,axonal transport,5/108,59/18866,2.19266E-05,0.000594338,0.000429877,AP3B2/AP3M2/HAP1/HIF1A/PAFAH1B1,5
GO:0035966,response to topologically incorrect protein,8/108,205/18866,2.35578E-05,0.00063247,0.000457458,HSP90AB1/HDAC6/HSF1/HSP90AA1/HSP90B1/HSPA1L/HSPA4L/HSPA8,8
GO:0001844,protein insertion into mitochondrial membrane involved in apoptotic signaling pathway,4/108,30/18866,2.48155E-05,0.000651311,0.000471085,YWHAB/YWHAE/YWHAG/YWHAQ,4
GO:0031116,positive regulation of microtubule polymerization,4/108,30/18866,2.48155E-05,0.000651311,0.000471085,AKAP9/CDK5RAP2/CKAP5/CLASP1,4
GO:0001578,microtubule bundle formation,6/108,101/18866,2.49527E-05,0.000651311,0.000471085,CCDC39/CCDC40/CCDC63/CCDC65/CDK5RAP2/CLASP1,6
GO:1902110,positive regulation of mitochondrial membrane permeability involved in apoptotic process,5/108,61/18866,2.58202E-05,0.000667772,0.000482991,GSK3B/YWHAB/YWHAE/YWHAG/YWHAQ,5
GO:0034377,plasma lipoprotein particle assembly,4/108,31/18866,2.83666E-05,0.00072696,0.000525801,APOC1/PRKACA/PRKACB/PRKACG,4
GO:1901215,negative regulation of neuron death,8/108,212/18866,2.9956E-05,0.000760775,0.000550259,HSP90AB1/AKT1/CLCF1/CTNNB1/GSK3B/HIF1A/HSF1/PSEN1,8
GO:1902686,mitochondrial outer membrane permeabilization involved in programmed cell death,5/108,63/18866,3.02306E-05,0.000760894,0.000550345,GSK3B/YWHAB/YWHAE/YWHAG/YWHAQ,5
GO:0043161,proteasome-mediated ubiquitin-dependent protein catabolic process,11/108,424/18866,3.16853E-05,0.000790451,0.000571723,HSP90AB1/AKT1/AURKA/CDK1/CSNK1A1/CSNK1D/CSNK1E/CTNNB1/GSK3B/HSP90B1/PSEN1,11
GO:0051651,maintenance of location in cell,8/108,216/18866,3.42245E-05,0.000846306,0.000612122,AKAP9/AKT1/CCDC88A/HAP1/HSP90B1/HTT/PAFAH1B1/PRKACA,8
GO:0035794,positive regulation of mitochondrial membrane permeability,5/108,65/18866,3.52043E-05,0.000855526,0.000618791,GSK3B/YWHAB/YWHAE/YWHAG/YWHAQ,5
GO:0051205,protein insertion into membrane,5/108,65/18866,3.52043E-05,0.000855526,0.000618791,HSP90AA1/YWHAB/YWHAE/YWHAG/YWHAQ,5
GO:0070286,axonemal dynein complex assembly,4/108,33/18866,3.65672E-05,0.00088105,0.000637252,CCDC39/CCDC40/CCDC63/CCDC65,4
GO:0003002,regionalization,10/108,355/18866,3.70445E-05,0.000884987,0.0006401,AR/AURKA/CTNNB1/CTNNBIP1/HHIP/HIPK1/HSPB11/PRKACA/PRKACB/PSEN1,10
GO:1902108,regulation of mitochondrial membrane permeability involved in apoptotic process,5/108,66/18866,3.79175E-05,0.000898231,0.000649679,GSK3B/YWHAB/YWHAE/YWHAG/YWHAQ,5
GO:0033138,positive regulation of peptidyl-serine phosphorylation,6/108,109/18866,3.84238E-05,0.000900614,0.000651403,HSP90AB1/AKAP9/AKT1/APP/HDAC6/HSP90AA1,6
GO:1904953,Wnt signaling pathway involved in midbrain dopaminergic neuron differentiation,3/108,12/18866,3.86571E-05,0.000900614,0.000651403,CSNK1D/CSNK1E/CTNNB1,3
GO:0007163,establishment or maintenance of cell polarity,8/108,220/18866,3.89905E-05,0.000900937,0.000651636,HSP90AB1/CDK5RAP2/CKAP5/CLASP1/GSK3B/HSP90AA1/HTT/PAFAH1B1,8
GO:1905710,positive regulation of membrane permeability,5/108,67/18866,4.07899E-05,0.000934852,0.000676167,GSK3B/YWHAB/YWHAE/YWHAG/YWHAQ,5
GO:0031112,positive regulation of microtubule polymerization or depolymerization,4/108,34/18866,4.12607E-05,0.000938016,0.000678455,AKAP9/CDK5RAP2/CKAP5/CLASP1,4
GO:0046822,regulation of nucleocytoplasmic transport,6/108,112/18866,4.477E-05,0.001009652,0.000730269,HSP90AB1/CDK1/GSK3B/PRKACA/PSEN1/YWHAE,6
GO:0045732,positive regulation of protein catabolic process,8/108,225/18866,4.57166E-05,0.001021449,0.000738801,AKT1/AURKA/CSNK1A1/CSNK1D/CSNK1E/GSK3B/HSP90AA1/PSEN1,8
GO:0040001,establishment of mitotic spindle localization,4/108,35/18866,4.63801E-05,0.001021449,0.000738801,CDK5RAP2/CLASP1/HTT/PAFAH1B1,4
GO:0065005,protein-lipid complex assembly,4/108,35/18866,4.63801E-05,0.001021449,0.000738801,APOC1/PRKACA/PRKACB/PRKACG,4
GO:0043434,response to peptide hormone,11/108,447/18866,5.1139E-05,0.001109415,0.000802426,AKT1/ANXA1/EEF2K/GSK3B/HDAC5/HSF1/PRKACA/PRKACB/PRKACG/PRKAR1A/YWHAG,11
GO:0045931,positive regulation of mitotic cell cycle,7/108,168/18866,5.13618E-05,0.001109415,0.000802426,AKT1/ANXA1/APP/AURKA/CDK1/HSF1/PAFAH1B1,7
GO:0033762,response to glucagon,4/108,36/18866,5.19485E-05,0.001109415,0.000802426,PRKACA/PRKACB/PRKACG/PRKAR1A,4
GO:0051294,establishment of spindle orientation,4/108,36/18866,5.19485E-05,0.001109415,0.000802426,CDK5RAP2/CLASP1/HTT/PAFAH1B1,4
GO:0050891,multicellular organismal water homeostasis,5/108,71/18866,5.40022E-05,0.001144602,0.000827876,HRNR/PRKACA/PRKACB/PRKACG/PRKAR1A,5
GO:0018107,peptidyl-threonine phosphorylation,6/108,117/18866,5.71918E-05,0.001203163,0.000870232,AKT1/APP/CDK1/GSK3B/HIPK1/PRKACA,6
GO:0003091,renal water homeostasis,4/108,37/18866,5.79895E-05,0.001210907,0.000875834,PRKACA/PRKACB/PRKACG/PRKAR1A,4
GO:2001234,negative regulation of apoptotic signaling pathway,8/108,233/18866,5.84802E-05,0.001212174,0.00087675,AKT1/AR/CTNNB1/GSK3B/HIF1A/HIGD1A/HTT/PSEN1,8
GO:1903747,regulation of establishment of protein localization to mitochondrion,5/108,73/18866,6.17369E-05,0.001263227,0.000913676,HSPA1L/YWHAB/YWHAE/YWHAG/YWHAQ,5
GO:0021543,pallium development,7/108,173/18866,6.18394E-05,0.001263227,0.000913676,CEP120/CTNNB1/GSK3B/HIF1A/PAFAH1B1/PSEN1/YWHAE,7
GO:0060560,developmental growth involved in morphogenesis,8/108,236/18866,6.39742E-05,0.001297434,0.000938418,HSP90AB1/APP/AURKA/CTNNB1/GSK3B/HDAC6/HSP90AA1/PAFAH1B1,8
GO:0048588,developmental cell growth,8/108,237/18866,6.58984E-05,0.00132691,0.000959738,HSP90AB1/APP/AURKA/CTNNB1/GSK3B/HDAC6/HSP90AA1/PAFAH1B1,8
GO:0099518,vesicle cytoskeletal trafficking,5/108,75/18866,7.02997E-05,0.001405495,0.001016577,AP3B2/AP3M2/HAP1/HTT/PAFAH1B1,5
GO:0010737,protein kinase A signaling,4/108,39/18866,7.15862E-05,0.001421138,0.001027891,PRKACA/PRKACB/PRKACG/PRKAR1A,4
GO:0007173,epidermal growth factor receptor signaling pathway,6/108,123/18866,7.55827E-05,0.001489982,0.001077686,AKT1/APP/CCDC88A/HAP1/HGS/PSEN1,6
GO:0046902,regulation of mitochondrial membrane permeability,5/108,77/18866,7.97499E-05,0.001561215,0.001129208,GSK3B/YWHAB/YWHAE/YWHAG/YWHAQ,5
GO:0018210,peptidyl-threonine modification,6/108,126/18866,8.63975E-05,0.001679687,0.001214896,AKT1/APP/CDK1/GSK3B/HIPK1/PRKACA,6
GO:0006986,response to unfolded protein,7/108,183/18866,8.8059E-05,0.001700262,0.001229778,HSP90AB1/HSF1/HSP90AA1/HSP90B1/HSPA1L/HSPA4L/HSPA8,7
GO:0030104,water homeostasis,5/108,79/18866,9.01491E-05,0.001719289,0.00124354,HRNR/PRKACA/PRKACB/PRKACG/PRKAR1A,5
GO:1905477,positive regulation of protein localization to membrane,6/108,127/18866,9.02642E-05,0.001719289,0.00124354,AKT1/SQSTM1/YWHAB/YWHAE/YWHAG/YWHAQ,6
GO:0035050,embryonic heart tube development,5/108,80/18866,9.57244E-05,0.001811055,0.001309913,CCDC39/CCDC40/CTNNB1/HIF1A/PSEN1,5
GO:0034380,high-density lipoprotein particle assembly,3/108,16/18866,9.6771E-05,0.001818649,0.001315406,PRKACA/PRKACB/PRKACG,3
GO:0051235,maintenance of location,9/108,324/18866,0.000102517,0.001913882,0.001384287,AKAP9/AKT1/CCDC88A/HAP1/HSP90B1/HTT/PAFAH1B1/PRKACA/YWHAB,9
GO:0040019,positive regulation of embryonic development,4/108,43/18866,0.000105536,0.001949161,0.001409804,AR/CLASP1/CTNNB1/PAFAH1B1,4
GO:0050769,positive regulation of neurogenesis,11/108,485/18866,0.00010579,0.001949161,0.001409804,AVIL/CLCF1/CSNK1D/CSNK1E/CTNNB1/EEF2K/HAP1/HIF1A/PAFAH1B1/PSEN1/TUBB2B,11
